faire une ligne entrée une ligne plâts et une ligne dessert, laisser la premiere ligne
ligne entrée midi;concombre; radis; salade de champignons persillés, salade de petits pois à la menthe; salami et cornichons
ligne plat midi;roti de boeuf confit d'échalotes; filet d'egletin au beurre citronné; coudes sauce crème de saumon et aneth;pommes de terre rôties au four; haricots verts et oignons caramélisés au sésame
ligne fromage midi;emmental;Camembert;fromages divers
ligne dessert midi;éclair au chocolat; fontainebleau à la poire et crumble cacao
ligne entrée soir;concombre; radis; salade de champignons persillés, salade de petits pois à la menthe; salami et cornichons
ligne plat soir;filet de poulet grillé; colin d'alaska sauce aux câpres; haricots blancs tomates et oignons; endives braisés
ligne fromage soir;emmental;Camembert;fromages divers
ligne dessert soir;éclair au chocolat; fontainebleau à la poire et crumble cacao
