faire une ligne entrée une ligne plâts et une ligne dessert, laisser la premiere ligne
ligne entrée midi;quartiers de betteraves persillés; salade de radis noir pomme et mache;salade de blé potiron et petits pois; terrine de campagne
ligne plat midi;rôti de porc à la méxicaine; filet de lieu noir sauce ciboulette; pâtes tortis tricolores émincé de volailles; blé aux oignons; tronçons de courgettes rôties
ligne fromage midi;emmental;Camembert;fromages divers
ligne dessert midi; Tarte bourdaloue aux poires; flamri au chocolat
ligne entrée soir;quartiers de betteraves persillés; salade de radis noir pomme et mache;salade de blé potiron et petits pois; terrine de campagne
ligne plat soir; paupiette de veausauce paprika; croc fromage végétale; pommes de terre rôties au thym; haricots plats persillés
ligne fromage soir;emmental;Camembert;fromages divers
ligne dessert soir;Tarte bourdaloue aux poires; flamri au chocolat
